{
  "chainId": 137,
  "reviewedAt": "2026-07-27T00:00:00Z",
  "source": "https://docs.polymarket.com/resources/contracts — official single source of truth, reviewed 2026-07-27",
  "contracts": {
    "conditionalTokens": { "address": "0x4D97DCd97eC945f40cF65F87097ACe5EA0476045", "expectedInterface": "ERC1155" },
    "pUSD": { "address": "0xC011a7E12a19f7B1f670d46F03B03f3342E82DFB", "expectedInterface": "ERC20" },
    "ctfCollateralAdapter": { "address": "0xAdA100Db00Ca00073811820692005400218FcE1f" },
    "negativeRiskCollateralAdapter": { "address": "0xadA2005600Dec949baf300f4C6120000bDB6eAab" },
    "ctfExchange": { "address": "0xE111180000d2663C0091e4f400237545B87B996B" },
    "negativeRiskCtfExchange": { "address": "0xe2222d279d744050d28e00520010520000310F59" },
    "umaAdapter": { "address": "0x6A9D222616C90FcA5754cd1333cFD9b7fb6a4F74" },
    "umaOptimisticOracle": { "address": "0xCB1822859cEF82Cd2Eb4E6276C7916e692995130" },
    "positionManager": { "address": "0x006F54F7f9A22e0000CC2AB60031000000ae9fEF" },
    "binaryModule": { "address": "0x1000008dD9001B968442c1000017eaE6E0dA00Ba" },
    "negativeRiskModule": { "address": "0x200000900045e3B6259600682756002200028933" },
    "combinatorialModule": { "address": "0x30000034706C7d8e12009DAB006Be20000c031A8" },
    "comboExchange": { "address": "0xe3333700cA9d93003F00f0F71f8515005F6c00Aa" },
    "autoRedeemer": { "address": "0xa1200000d0002264C9a1698e001292D00E1b00af" }
  }
}
