{
  "chainId": 31337,
  "reviewedAt": "2026-07-27T06:58:00Z",
  "source": "Deterministic DeployLocal.s.sol broadcast from Anvil account 0",
  "contracts": {
    "pUSD": { "address": "0x5fbdb2315678afecb367f032d93f642f64180aa3", "expectedInterface": "ERC20" },
    "conditionalTokens": { "address": "0xe7f1725e7734ce288f8367e1bb143e90bb3f0512", "expectedInterface": "ERC1155" },
    "ctfCollateralAdapter": { "address": "0x9fe46736679d2d9a65f0992f2272de9f3c7fa6e0" },
    "resolutionOracle": { "address": "0xcf7ed3acca5a467e9e704c703e8d87f634fb0fc9" },
    "relationshipRegistry": { "address": "0xdc64a140aa3e981100a9beca4e685f962f0cf6c9" },
    "claims": { "address": "0x5fc8d32690cc91d4c39d9d3abcbd16989f875707" },
    "fundingPool": { "address": "0x0165878a594ca255338adfa4d48449f69242eb8f" },
    "treasury": { "address": "0xa513e6e4b8f2a923d98304ec87f64353c4d5c853" },
    "vault": { "address": "0x2279b7a0a67db372996a5fab50d91eaa73d2ebe6" }
  }
}
